[
  {
    "id": "studies-embedded",
    "org": "Université de Reims Champagne-Ardenne",
    "role": "Licence → Master STIC EEA, Informatique embarquée",
    "type": "education",
    "start": "2006-09",
    "end": "2009-06",
    "location": "Reims",
    "note": "Premier code en 2006 (Licence). C/C++ embarqué, premiers pas C#/.NET.",
    "tech_weights": {
      "c-cpp": "primary",
      "csharp-dotnet": "secondary",
      "windows-ce": "secondary"
    }
  },
  {
    "id": "robotics-cup",
    "org": "Coupe de France de Robotique",
    "role": "Projet de fin d'études — robot autonome",
    "type": "competition",
    "start": "2008-09",
    "end": "2009-06",
    "location": "Reims",
    "note": "Vision embarquée, positionnement robot, PIC16F1938 en C. 28e/200+ équipes.",
    "tech_weights": {
      "c-cpp": "primary",
      "computer-vision": "primary"
    }
  },
  {
    "id": "gunnebo",
    "org": "Gunnebo",
    "role": "Stagiaire Ingénieur Systèmes Embarqués",
    "type": "internship",
    "start": "2009-04",
    "end": "2009-07",
    "location": "Bazancourt",
    "note": "Driver embarqué automate de dépôt d'espèces sous Windows CE 5.0, DLL C machine à états. 100+ machines en prod.",
    "tech_weights": {
      "c-cpp": "primary",
      "windows-ce": "primary"
    }
  },
  {
    "id": "goodkap",
    "org": "GoodKap!",
    "role": "Ingénieur Développement Systèmes Embarqués",
    "type": "cdi",
    "start": "2009-10",
    "end": "2010-12",
    "location": "Saint-Aubin",
    "note": "Startup GPS connectés. SDK C/C++ Windows CE, client/serveur TCP C# .NET, Web Services SOAP.",
    "tech_weights": {
      "c-cpp": "primary",
      "csharp-dotnet": "primary",
      "windows-ce": "secondary",
      "gps": "secondary",
      "git": "incident"
    }
  },
  {
    "id": "neurones",
    "org": "Neurones Assistance",
    "role": "Ingénieur Développement Systèmes Embarqués",
    "type": "cdi",
    "start": "2011-01",
    "end": "2011-11",
    "location": "Poissy",
    "note": "Reprise technique GoodKap. Service embarqué C/C++ vitesse-limite GPS, service Windows C# API SOGENACTIF, VMware, AD.",
    "tech_weights": {
      "c-cpp": "primary",
      "csharp-dotnet": "secondary",
      "windows-ce": "secondary",
      "gps": "secondary",
      "windows": "secondary"
    }
  },
  {
    "id": "theoris-ingenico",
    "org": "Theoris SAS · mission Ingenico",
    "role": "Ingénieur Analyste — paiement mobile",
    "type": "mission",
    "start": "2011-12",
    "end": "2012-09",
    "location": "Paris",
    "note": "Librairie Objective-C NFC (Mifare) iOS — utilisée downstream par Nespresso. Protocole Bluetooth, app Android.",
    "tech_weights": {
      "objective-c": "primary",
      "nfc": "primary",
      "bluetooth": "secondary",
      "c-cpp": "secondary",
      "windows-ce": "incident",
      "gps": "incident"
    }
  },
  {
    "id": "theoris-systar",
    "org": "Theoris SAS · mission Systar",
    "role": "Ingénieur Analyste — monitoring serveurs",
    "type": "mission",
    "start": "2012-10",
    "end": "2013-03",
    "location": "Saint-Cloud",
    "note": "C sous AIX/Power7, correction fuites mémoire C/C++ Windows, optimisation SQL, multithreading.",
    "tech_weights": {
      "c-cpp": "primary",
      "windows": "secondary"
    }
  },
  {
    "id": "theoris-dassault",
    "org": "Theoris SAS · mission Dassault Systèmes",
    "role": "Ingénieur Analyste — réalité augmentée Rafale",
    "type": "mission",
    "start": "2013-04",
    "end": "2013-04",
    "location": "Paris",
    "note": "Interface tablette Windows RT en C++/CLI, visualisation circuits avioniques.",
    "tech_weights": {
      "c-cpp": "primary",
      "windows": "incident"
    }
  },
  {
    "id": "theoris-ondeo",
    "org": "Theoris SAS · mission Ondeo Systems",
    "role": "Ingénieur Analyste — compteurs Gazpar",
    "type": "mission",
    "start": "2013-05",
    "end": "2014-02",
    "location": "Le Pecq",
    "note": "Chaîne logicielle de configuration NFC sous Windows Mobile 6. Librairie C# .NET NFC, driver USB, trousseau de clés.",
    "tech_weights": {
      "csharp-dotnet": "primary",
      "nfc": "primary",
      "windows-mobile": "primary",
      "git": "secondary"
    }
  },
  {
    "id": "goodangel-mgl-p1",
    "org": "Good Angel / My Good Life",
    "role": "Chef de projet puis CTO (phase mobile)",
    "type": "cdi",
    "start": "2014-04",
    "end": "2020-01",
    "location": "Remote (Région parisienne)",
    "note": "Entités parallèles. Éthylotest connecté (Bluetooth/GATT custom), santé connectée. Xamarin cross-platform, API REST JWT, marque blanche AXA/LVMH/Sodexo.",
    "tech_weights": {
      "xamarin-forms": "primary",
      "csharp-dotnet": "primary",
      "bluetooth": "primary",
      "asp-net-web-api-2": "secondary",
      "git": "secondary",
      "objective-c": "incident",
      "azure": "incident"
    }
  },
  {
    "id": "goodangel-mgl-p2",
    "org": "Good Angel / My Good Life",
    "role": "CTO (phase modernisation)",
    "type": "cdi",
    "start": "2020-01",
    "end": "2023-04",
    "location": "Remote (Région parisienne)",
    "note": "Migration .NET Core, adoption Blazor + MudBlazor, EF Core, Docker, GitHub Actions. Maintien produit éthylotest Bluetooth.",
    "tech_weights": {
      "csharp-dotnet": "primary",
      "blazor": "secondary",
      "asp-net-core": "secondary",
      "ef-core": "secondary",
      "docker": "secondary",
      "xamarin-forms": "secondary",
      "bluetooth": "secondary",
      "git": "secondary",
      "linux-ubuntu": "secondary",
      "windows": "secondary",
      "azure": "incident",
      "github-actions": "incident"
    }
  },
  {
    "id": "freelance",
    "org": "Indépendant",
    "role": "CTO freelance & architecte de solutions",
    "type": "freelance",
    "start": "2023-04",
    "end": null,
    "location": "Senas, Provence",
    "note": "Architecture, AI-driven development (Claude Code en outil principal), tooling Python, nodes blockchain, libs .NET (Here.Sdk, CometBFT.Client).",
    "tech_weights": {
      "ai-driven-development": "primary",
      "python": "primary",
      "git": "primary",
      "csharp-dotnet": "secondary",
      "docker": "secondary",
      "linux-ubuntu": "secondary",
      "bash": "secondary",
      "windows": "incident",
      "github-actions": "secondary",
      "fastapi": "incident",
      "cometbft": "incident",
      "cosmos-sdk": "incident",
      "typescript": "incident",
      "nodejs": "incident",
      "react-next": "incident",
      "litellm": "incident",
      "claude-api": "incident",
      "azure": "incident"
    }
  }
]
